Folder,File Name,Class Name,Class Parameters (Inheritance),Class Responsibility / Purpose,Dependencies (General)
tests\unit/,test_validation_utils.py,TestAPIKeyValidation,None,Test API key validation.,N/A (See Imports)
tests\unit/,test_validation_utils.py,TestDrawingIDValidation,None,Test drawing ID validation.,N/A (See Imports)
tests\unit/,test_validation_utils.py,TestFileSizeValidation,None,Test file size validation.,N/A (See Imports)
tests\unit/,test_validation_utils.py,TestModelPathValidation,None,Test model path validation.,N/A (See Imports)
tests\unit/,test_validation_utils.py,TestComplexValidations,None,Test complex validation scenarios.,N/A (See Imports)
tests\unit/,test_validation_utils.py,TestEdgeCases,None,Test edge cases and error handling.,N/A (See Imports)
tests\utils/,test_helpers.py,MockLLMGateway,None,Mock LLM Gateway for testing.,N/A (See Imports)
tests\utils/,test_helpers.py,PerformanceTimer,None,Context manager for timing operations.,N/A (See Imports)
